MISCELLANEOUS,Miscellaneous gears,Pushnets,MPN,Dimensions + Description + Number of gears,"Dimensions: Mandatory - net dimensions (width/length)","Description: Mandatory - pushnet design details","Number: Mandatory - count of pushnets",Gear Set Model,1. Common dimensions to standardize? Width? Depth?,Medium,Nets pushed through water/substrate. Likely have typical dimension patterns.
MISCELLANEOUS,Miscellaneous gears,Scoopnets,MSP,Dimensions + Description + Number of gears,"Dimensions: Mandatory - net dimensions (diameter/depth)","Description: Mandatory - scoopnet type","Number: Mandatory - count of nets",Gear Set Model,1. Diameter and depth most relevant? Standardize these?,Medium,Hand-held scoop nets. Likely have standard dimensions to capture.
MISCELLANEOUS,Miscellaneous gears,Drive-in nets,MDR,Dimensions + Description + Number of gears,"Dimensions: Mandatory - net dimensions","Description: Mandatory - net design and use","Number: Mandatory - count of nets",Gear Set Model,1. What exactly is a drive-in net? Need definition?,Medium,Specialized technique. May need explanation/examples for fishers.
MISCELLANEOUS,Miscellaneous gears,Diving,MDV,Dimensions + Description + Number of gears,"Dimensions: Mandatory - relevant measurements (depth rating? free text?)","Description: Mandatory - diving method/equipment details","Number: Mandatory - count (divers? sets of equipment?)",Individual Unit Model?,"1. UNUSUAL: ""Number"" = divers or equipment sets? 2. Dimensions = depth rating? equipment specs? 3. Should this even be ""gear"" or a fishing method?",Complex,"UNUSUAL category - diving is a method not physical gear. May need rethinking of data model. What are we actually registering?"
MISCELLANEOUS,Miscellaneous gears,Harvesting machines (not elsewhere specified),HMX,Dimensions + Description + Number of gears,"Dimensions: Mandatory - machine specifications","Description: Mandatory - machine type and capacity","Number: Mandatory - count of machines",Gear Set Model,"1. Very broad category - dredges, rakes, etc? 2. Power source relevant?",Complex,"Mechanical harvesting equipment. Very broad - may need subcategories. Overlap with dredges?"
MISCELLANEOUS,Miscellaneous gears,Gear (not elsewhere specified),MIS,Dimensions + Description + Number of gears,"Dimensions: Mandatory - relevant measurements","Description: Mandatory - gear description","Number: Mandatory - count of gear units",Gear Set Model with free text,"1. Ultimate catch-all - should strongly guide to specific types 2. Validation challenges 3. Examples needed",Complex,"Ultimate catch-all category. Should be rare - guide users to specific categories. Need strong help text and examples."
